title,author name,type,rating,price
My First Library: Boxset of 10 Board Books for Kids,Wonder House Books,Board book,4.5 out of 5 stars,365.00
Oswaal CBSE Term 2 English Science Social Science & Math Standard Class 10 Sample Question Paper (Set of 4 Books) (For Term-2 2022 Exam) Free Access Code For Oswaal 360,Oswaal Editorial Board,Product Bundle,4.8 out of 5 stars,424.00
Word Power Made Easy,Norman Lewis,Paperback,4.4 out of 5 stars,98.00
"Grandma's Bag of Stories: Collection of 20+ Illustrated short stories, traditional Indian folk tales for all ages for children of all ages by Sudha Murty",Sudha Murty,Paperback,4.6 out of 5 stars,175.00
Harry Potter and the Philosopher's Stone,J.K. Rowling,Kindle Edition,4.7 out of 5 stars,299.00
"My First Mythology Tale (Illustrated) (Set of 5 Books) - Mahabharata, Krishna, Hanuman, Ganesha, Ramayana - Story Book for Kids",Maple Press,Paperback,4.5 out of 5 stars,170.00
My First Book of Pencil Control : Practice Pattern Writing (Full Color Pages): Patterns Practice book for kids (Pattern Writing),Wonder House Books,Paperback,4.4 out of 5 stars,89.00
Moral Story Books for Kids (Pack of 10 Books) | 160 Total Pages | Illustrated Stories,Young Angels Publishing,Paperback,4.3 out of 5 stars,240.00
Very First Sight Words Sentences Level 1,Dreamland Publications,Paperback,4.5 out of 5 stars,140.00
Picture Books Collection for Early Learning (Set of 12),E C Axus,Cards,4.3 out of 5 stars,240.00
"Writing Practice Boxset: Pack of 4 Books (Writing Fun: Write and Practice Capital Letters, Small Letters, Patterns and Numbers 1 to 10)",Wonder House Books,Paperback,4.3 out of 5 stars,159.00
Brain Activity Book for Kids - 200+ Activities for Age 3+,Maple Press,Paperback,4.6 out of 5 stars,86.00
My First 4 in 1 Alphabet Numbers Colours Shapes: Padded Board Books,Wonder House Books,Board book,4.3 out of 5 stars,159.00
Great Stories for Children,Ruskin Bond,Paperback,4.5 out of 5 stars,135.00
Colour With Crayons Book 1 for Kids Age 1 -6 Years - Drawing and Colouring Book for Early Learners,Dreamland Publications,Paperback,4.2 out of 5 stars,49.00
My First Complete Learning Library: Boxset of 20 Board Books Gift Set for Kids (Horizontal Design): Box Set of 20 Board Books for Children,Wonder House Books,Board book,4.6 out of 5 stars,599.00
101 Panchatantra Stories for Children: Colourful Illustrated Stories,Om Books Editorial Team,Paperback,4.5 out of 5 stars,100.00
Best of Children’s Classics (Set of 5 Books): Perfect Gift Set for Kids,Antoine de Saint-Exupéry,Paperback,4.4 out of 5 stars,487.00
Nursery Rhymes Board Book (My First Book Series): Illustrated Classic Nursery Rhymes,Wonder House Books,Board book,4.6 out of 5 stars,149.00
108 Panchatantra Stories (Illustrated) for children,Maple Press,Paperback,4.4 out of 5 stars,90.00
Wren & Martin High School English Grammar And Composition Book (Regular Edition),"Rao N,D,V,Prasada",Paperback,4.5 out of 5 stars,310.00
Animals Tales From Panchtantra: Timeless Stories for Children From Ancient India,Wonder House Books,Hardcover,4.5 out of 5 stars,169.00
Encyclopedia: Amazing Questions & Answers Science,Om Books Editorial Team,Paperback,4.5 out of 5 stars,139.30
Baby Touch: Playbook,Ladybird,Board book,4.6 out of 5 stars,279.00
Peppa Pig: Little Library,Peppa Pig,Board book,4.3 out of 5 stars,153.00
"Xam idea Class 10 Science Book For CBSE Term 2 Exam (2021-2022) With New Pattern Including Basic Concepts, NCERT Questions and Practice Questions",Xamidea Editorial Board,Paperback,4.6 out of 5 stars,111.00
"Brain Games for Clever Kids: Puzzles to Exercise Your Mind (Buster Brain Games, 1)",Gareth Moore,Paperback,4.3 out of 5 stars,139.00
"The Magic of the Lost Temple: Illustrated, easy to read and much-loved first full length children’s fiction novel by Sudha Murty for ages 8–12: ... fiction novel by Sudha Murty for ages 8–12",Sudha Murty,Paperback,4.7 out of 5 stars,143.00
The Blue Umbrella,Ruskin Bond,Paperback,4.5 out of 5 stars,95.00
Arihant CBSE Science Term 2 Class 10 for 2022 Exam (Cover Theory and MCQs),"Anam Aarzoo Naman jain , Jyoti Agarwal ",Paperback,4.5 out of 5 stars,70.00
101 Brain Booster Activity Book: Fun Activity Book For Children,Wonder House Books,Paperback,4.4 out of 5 stars,139.00
NCERT Textbooks in English for class 12 - Flamingo and Vistas - 12074 &12075,NCERT,Paperback,4.4 out of 5 stars,68.00
"Oswal - Gurukul 36 Sample Question Papers Commerce CBSE Class 12 Term II Exam 2022 : Solved New SQP Pattern (Accountancy, Business Studies, Economics, Mathematics, English, Physical Education)",Oswal - Gurukul,Paperback,5.0 out of 5 stars,303.00
Mathematics For Class 10 By R D Sharma (Examination 2020-2021),R.D. Sharma,Paperback,4.5 out of 5 stars,508.00
Grandparents' Bag of Stories,Sudha Murty,Paperback,4.7 out of 5 stars,165.00
Moral Stories for Children -Set of 10 Illustrated Books (Packed in a Gift Box),Om Books Editorial Team,Paperback,4.3 out of 5 stars,225.00
ஓநாயும் ஆட்டுக்குட்டியும் (Tamil Edition),SANAGEETH NOVELS,Kindle Edition,4.1 out of 5 stars,150.00
Moral Story Books for Kids (Set of 10 Books),Maple Press,Paperback,4.6 out of 5 stars,199.00
"My First Super Boxset of Pencil Control and Patterns : Pack of 4 interactive activity books to practice Patterns, Numbers and Alphabet: A set of 4 ... to practice Patterns, Numbers and Alphabet",Wonder House Books,Paperback,4.5 out of 5 stars,250.00
Ruskin Bond - Best Selling Children Story Books Collection (Set of 4 Books),Ruskin Bond,Product Bundle,4.5 out of 5 stars,381.00
"Educart TERM 2 CBSE Question Bank Bundle - Maths, Science, English & SST For Class 10 Of 2022 (Now Based on the Term-2 Subjective Sample Paper of 14 Jan 2022)",Educart,Product Bundle,4.4 out of 5 stars,615.00
My First ABC Sticker Book: Exciting Sticker Book With 100 Stickers,Wonder House Books,Paperback,4.4 out of 5 stars,139.00
Arihant CBSE English Core Term 2 Class 12 for 2022 Exam (Cover Theory and MCQs),Sristi Agarwal,Paperback,4.5 out of 5 stars,120.00
"Xam idea Class 10 Social Science Book For CBSE Term 2 Exam (2021-2022) With New Pattern Including Basic Concepts, NCERT Questions and Practice Questions",Xamidea Editorial Board,Paperback,4.2 out of 5 stars,134.00
"Xam idea Class 12 Physics Book For CBSE Term 2 Exam (2021-2022) With New Pattern Including Basic Concepts, NCERT Questions and Practice Questions",Xamidea Editorial Board,Paperback,4.5 out of 5 stars,154.00
"My First 1000 Words: Early Learning Picture Book to Learn Alphabet, Numbers, Shapes and Colours, Transport, Birds and Animals, Professions, Opposite ... Parts of the body and Objects Around Us.",Wonder House Books,Paperback,4.5 out of 5 stars,193.00
"Arihant CBSE Physics ,Chemistry,Mathmatics & English Core Term 2 Class 12 for 2022 Exam (Cover Theory and MCQs) (Set of 4 Books)",Arihant Experts,Paperback,4.3 out of 5 stars,453.00
GIKSO 100 Maths Puzzles Book - Brain Boosting Mathematical Activities for Age 7+ Years Old Kids | Game Book (English) - Reprinted 2021,GIKSO,Paperback,4.3 out of 5 stars,179.00
"Arihant CBSE Science , Social science , Mathematics (Standard) and English Language & Literature Term 2 Class 10 for 2022 Exam (Cover Theory and MCQs) (Set of 4 Books)",Arihant Experts,Paperback,4.2 out of 5 stars,400.00
"Blossom Moral Story Book for Kids 1 Years to 10 Years Old in English | 31 Fairy Tale Stories with Colourful Pictures | Best Bedtime Children Story Book | Short Stories for Infants, Toddlers | Book A",Content Team at Target Publications,Paperback,4.4 out of 5 stars,80.00
